{
  "$schema": "https://json-schema.org/draft/2020-12/schema",
  "$id": "https://raw.githubusercontent.com/VortikRegistry/vortik-open-schema/main/schemas/agents/vortik-agent-discovery/1.2.0/schema.json",
  "title": "Vortik Agent Discovery Manifest 1.2.0",
  "description": "Closed machine-readable discovery manifest for implemented public Vortik capabilities and contracts, including ENS research and a candidate-contribution contract without a Vortik-operated live submission endpoint.",
  "type": "object",
  "additionalProperties": false,
  "required": ["$schema", "manifest", "manifest_version", "project", "interaction", "capabilities", "authority", "trust_boundary"],
  "properties": {
    "$schema": {"const": "https://raw.githubusercontent.com/VortikRegistry/vortik-open-schema/main/schemas/agents/vortik-agent-discovery/1.2.0/schema.json"},
    "manifest": {"const": "vortik-agent-discovery"},
    "manifest_version": {"const": "1.2.0"},
    "project": {
      "type": "object",
      "additionalProperties": false,
      "required": ["name", "description", "repository", "public_site"],
      "properties": {
        "name": {"const": "Vortik Registry"},
        "description": {"type": "string", "minLength": 1},
        "repository": {"const": "https://github.com/VortikRegistry/vortik-open-schema"},
        "public_site": {"const": "https://vortikregistry.github.io/vortik-open-schema/"}
      }
    },
    "interaction": {
      "type": "object",
      "additionalProperties": false,
      "required": ["mode", "a2a_server", "live_network_ingress", "agent_card_published", "note"],
      "properties": {
        "mode": {"const": "discovery_only"},
        "a2a_server": {"const": false},
        "live_network_ingress": {"const": false},
        "agent_card_published": {"const": false},
        "note": {"type": "string", "minLength": 1}
      }
    },
    "capabilities": {
      "type": "array",
      "minItems": 4,
      "maxItems": 4,
      "items": {
        "oneOf": [
          {
            "type": "object",
            "additionalProperties": false,
            "required": ["id", "kind", "description", "local_entrypoint", "public_entrypoint", "contract", "network_required_by_repository_runtime"],
            "properties": {
              "id": {"const": "discover_vortik_feeds"},
              "kind": {"const": "public_artifact"},
              "description": {"type": "string", "minLength": 1},
              "local_entrypoint": {"const": "feeds/index.json"},
              "public_entrypoint": {"const": "https://vortikregistry.github.io/vortik-open-schema/feeds/index.json"},
              "contract": {"const": "schemas/feeds/vortik-feed-index/1.0.0/schema.json"},
              "network_required_by_repository_runtime": {"const": false}
            }
          },
          {
            "type": "object",
            "additionalProperties": false,
            "required": ["id", "kind", "description", "local_entrypoint", "documentation", "request_contract", "response_contract", "network_required_by_repository_runtime"],
            "properties": {
              "id": {"const": "research_ens_semantics"},
              "kind": {"const": "local_library"},
              "description": {"type": "string", "minLength": 1},
              "local_entrypoint": {"const": "lib/ens-research-client.mjs"},
              "documentation": {"const": "docs/ens-research-client.md"},
              "request_contract": {"const": "schemas/queries/vortik-ens-research-request/1.0.0/schema.json"},
              "response_contract": {"const": "schemas/queries/vortik-ens-research-response/1.0.0/schema.json"},
              "network_required_by_repository_runtime": {"const": false}
            }
          },
          {
            "type": "object",
            "additionalProperties": false,
            "required": ["id", "kind", "description", "request_contract", "response_contract", "public_request_contract", "public_response_contract", "local_execution_entrypoint", "submission_available", "network_required_by_repository_runtime"],
            "properties": {
              "id": {"const": "inbound_ens_research_contract"},
              "kind": {"const": "public_contract"},
              "description": {"type": "string", "minLength": 1},
              "request_contract": {"const": "schemas/queries/vortik-ens-research-request/1.0.0/schema.json"},
              "response_contract": {"const": "schemas/queries/vortik-ens-research-response/1.0.0/schema.json"},
              "public_request_contract": {"const": "https://vortikregistry.github.io/vortik-open-schema/schemas/queries/vortik-ens-research-request/1.0.0/schema.json"},
              "public_response_contract": {"const": "https://vortikregistry.github.io/vortik-open-schema/schemas/queries/vortik-ens-research-response/1.0.0/schema.json"},
              "local_execution_entrypoint": {"const": "lib/ens-research-client.mjs"},
              "submission_available": {"const": false},
              "network_required_by_repository_runtime": {"const": false}
            }
          },
          {
            "type": "object",
            "additionalProperties": false,
            "required": ["id", "kind", "description", "contract", "public_contract", "documentation", "submission_available", "automatic_promotion", "network_required_by_repository_runtime"],
            "properties": {
              "id": {"const": "prepare_ens_candidate_contribution"},
              "kind": {"const": "public_contract"},
              "description": {"type": "string", "minLength": 1},
              "contract": {"const": "schemas/queries/vortik-ens-candidate-contribution/1.0.0/schema.json"},
              "public_contract": {"const": "https://vortikregistry.github.io/vortik-open-schema/schemas/queries/vortik-ens-candidate-contribution/1.0.0/schema.json"},
              "documentation": {"const": "docs/ens-candidate-contributions.md"},
              "submission_available": {"const": false},
              "automatic_promotion": {"const": false},
              "network_required_by_repository_runtime": {"const": false}
            }
          }
        ]
      },
      "allOf": [
        {"contains": {"type": "object", "properties": {"id": {"const": "discover_vortik_feeds"}}, "required": ["id"]}, "minContains": 1, "maxContains": 1},
        {"contains": {"type": "object", "properties": {"id": {"const": "research_ens_semantics"}}, "required": ["id"]}, "minContains": 1, "maxContains": 1},
        {"contains": {"type": "object", "properties": {"id": {"const": "inbound_ens_research_contract"}}, "required": ["id"]}, "minContains": 1, "maxContains": 1},
        {"contains": {"type": "object", "properties": {"id": {"const": "prepare_ens_candidate_contribution"}}, "required": ["id"]}, "minContains": 1, "maxContains": 1}
      ]
    },
    "authority": {
      "type": "object",
      "additionalProperties": false,
      "required": ["protocol_authority", "ens_authority", "ownership_inference", "commercial_authority", "note"],
      "properties": {
        "protocol_authority": {"const": false},
        "ens_authority": {"const": false},
        "ownership_inference": {"const": false},
        "commercial_authority": {"const": false},
        "note": {"type": "string", "minLength": 1}
      }
    },
    "trust_boundary": {
      "type": "object",
      "additionalProperties": false,
      "required": ["canonical_artifacts_only", "live_ens_resolution", "external_web_retrieval", "mcp_source_ingestion", "external_content_trusted", "note"],
      "properties": {
        "canonical_artifacts_only": {"const": true},
        "live_ens_resolution": {"const": false},
        "external_web_retrieval": {"const": false},
        "mcp_source_ingestion": {"const": false},
        "external_content_trusted": {"const": false},
        "note": {"type": "string", "minLength": 1}
      }
    }
  }
}
